{
  "artifact_id": "ART_PUBLIC_PROSE_TESSA_BUSBY",
  "artifact_type": "public_prose",
  "schema_version": "1.0",
  "generated_at": "2026-06-11T00:00:00Z",
  "source_id": "DOC_ARCH_PHILIP_K_DICK_THE_SELECTED_LETTERS_OF_PH",
  "generated_by": {
    "agent_role": "writing_agent",
    "name": "Claude (Haiku 4.5) writing person entry",
    "model": "claude-haiku-4-5-20251001",
    "prompt_version": "public_prose.person.v1"
  },
  "input_artifact_ids": [
    "ART_RAW_EXTRACTION_DOC_ARCH_PHILIP_K_DICK_LETTERS_PEOPLE_TESSA",
    "ART_VALIDATION_DOC_ARCH_PHILIP_K_DICK_LETTERS_TESSA",
    "ART_CURATION_DOC_ARCH_PHILIP_K_DICK_LETTERS_PEOPLE"
  ],
  "generated_from_artifacts": [
    {
      "artifact_id": "ART_RAW_EXTRACTION_DOC_ARCH_PHILIP_K_DICK_LETTERS_PEOPLE_TESSA",
      "artifact_type": "raw_extraction"
    }
  ],
  "title": "Tessa Busby",
  "dek_or_short_description": "PKD's fourth wife. Met in July 1972 in Fullerton, California; married 1973. Mother of Christopher Kenneth Dick. Separated 1976.",
  "body_markdown": "Tessa Busby (also known as Leslie) entered PKD's life in July 1972 in Fullerton, California, at a critical moment — after the break-in investigation and as PKD was beginning to process the 2-3-74 experiences. They married in 1973 and had a son, Christopher Kenneth Dick, also born that year.\n\nBy the time of the *Selected Letters*, Tessa appears in co-signed letters, indicating she was living with PKD and deeply involved in his daily life. However, the marriage was brief; they separated in 1976. Despite the short duration, the relationship fell during one of PKD's most creatively intense periods — the composition of the *Exegesis* was underway, and PKD was grappling with the theological and metaphysical aftermath of March 1974.\n\nLike Nancy Hackett, Tessa represented PKD's ongoing struggle to maintain intimate relationships while consumed by paranoia, religious obsession, and literary ambition. The letters suggest a man trying to build domestic stability even as his inner world grew increasingly turbulent and strange.",
  "summary": "Tessa Busby (1973–1976), PKD's fourth wife. Met in Fullerton in July 1972; married 1973. Mother of Christopher Kenneth Dick. Marriage brief but concurrent with PKD's intense Exegesis composition period.",
  "tags": ["tessa_busby", "pkd_wife", "pkd_family", "christopher_dick", "biography"],
  "citations_or_source_links": [
    {
      "label": "The Selected Letters of Philip K. Dick (1972–1973 entries)",
      "uri": null,
      "source_id": "DOC_ARCH_PHILIP_K_DICK_THE_SELECTED_LETTERS_OF_PH"
    }
  ],
  "editorial_status": "reviewed",
  "prototype_mode": false,
  "revision_notes": "Extracted from letters; dates and relationships grounded in correspondence. Contextualizes Tessa within the broader pattern of PKD's marriages and the period of Exegesis composition. Ready for publication."
}
