{"artifact_id":"ART_PUBLIC_PROSE_SANDRA_MIESEL","artifact_type":"public_prose","schema_version":"1.0","generated_at":"2026-06-11T00:00:00Z","source_id":"DOC_ARCH_PHILIP_K_DICK_THE_SELECTED_LETTERS_OF_PH","generated_by":{"agent_role":"writing_agent","name":"Claude (Haiku 4.5)","model":"claude-haiku-4-5-20251001","prompt_version":"public_prose.person.v1"},"input_artifact_ids":["ART_RAW_EXTRACTION_DOC_ARCH_PHILIP_K_DICK_LETTERS_PEOPLE_SANDRA","ART_VALIDATION_DOC_ARCH_PHILIP_K_DICK_LETTERS_SANDRA","ART_CURATION_DOC_ARCH_PHILIP_K_DICK_LETTERS_PEOPLE"],"generated_from_artifacts":[{"artifact_id":"ART_RAW_EXTRACTION_DOC_ARCH_PHILIP_K_DICK_LETTERS_PEOPLE_SANDRA","artifact_type":"raw_extraction"}],"title":"Sandra Miesel","dek_or_short_description":"Early PKD fan and scholar. Frequent correspondence about literary analysis and PKD's work.","body_markdown":"Sandra Miesel was among the earliest dedicated scholars of Philip K. Dick's work, part of a generation of fans and critics who took SF seriously as literature worthy of close analysis. Her correspondence with PKD shows the development of a professional relationship grounded in genuine intellectual engagement.\n\nMiesel belonged to that important class of readers and critics who help create an author's reputation. She wrote about his work, corresponded with him about its meanings and implications, and contributed to the slow process of moving PKD from genre writer to recognized major literary figure.\n\nWhat is notable is that PKD seemed to value this kind of critical attention. He answered Miesel's letters, took her questions seriously, and maintained correspondence with someone who was simultaneously a fan and an emerging scholar. This reflects PKD's hunger for the kind of validation that comes from being taken seriously as a literary artist, not merely an entertainer.\n\nMiesel's work was part of the foundational scholarship that would eventually make PKD's literary standing secure. In the 1970s, that scholarship was still speculative, still meeting resistance from the mainstream literary establishment. Figures like Miesel were doing the slow, unglamorous work of close reading and careful analysis that created the conditions for later recognition.","summary":"Sandra Miesel (1972–1973+), early PKD fan and scholar. Frequent correspondence about literary analysis and PKD's work.","tags":["sandra_miesel","scholar","fan","critic","biography"],"citations_or_source_links":[{"label":"The Selected Letters of Philip K. Dick (1972–1973 entries)","uri":null,"source_id":"DOC_ARCH_PHILIP_K_DICK_THE_SELECTED_LETTERS_OF_PH"}],"editorial_status":"reviewed","prototype_mode":false,"revision_notes":"Extracted from correspondence. Shows role of early fans/scholars in creating literary reputation. Ready for publication."}
